name,synopsis,aired_on,type_of,mal_id
Akatsuki no Yona,"Princess Yona lives a life of luxury and ease, completely sheltered from the problems of the seemingly peaceful Kingdom of Kouka; however, the sudden murder of the king and betrayal of her beloved cousin Su-won places Yona's life in mortal peril. Forced to escape only with Son Hak, who is both her childhood friend and bodyguard, the naïve princess soon discovers that Kouka is not the idyllic place she envisioned it to be. Poverty, strife, and corruption run rampant, making reclaiming the throne nothing more than a wishful fantasy given the kingdom's current state.

Based on the popular manga of the same name by Mizuho Kusanagi, Akatsuki no Yona follows Princess Yona on a coming-of-age adventure as she faces the harsh realities of her kingdom. With only a mysterious legend to guide her, Yona must discover a way to restore Kouka to its former glory while being pursued relentlessly by the forces of the new King of Kouka.

[Written by MAL Rewrite]",2014-10-07,TV,25013
Toaru Majutsu no Index II,"Index is still a fugitive and many powerful Magical organizations and individuals want to take her to use the books in her memory eliminating her in the process. War between those organizations is also starting to emerge. Index can only rely on her friend Touma who has always protected her along with Misaka and other friends from the Academy.

(Source: ANN)",2010-10-08,TV,8937
Trinity Seven,"“Awaken now, Kasuga Arata.” With those words, Arata’s uneventful, carefree life ends forever. A black shadow covers the sun and Arata’s entire town is reduced to rubble, all the people in it spirited away by the blackness of the sun in an event called a ""breakdown phenomenon"". As Arata’s memories come flooding back, he realizes he’s been living inside an illusion created by a powerful book of spells.

Lilith Asami, a mage dispatched to investigate the phenomenon, gives Arata two choices: hand over the book, or die. Arata chooses the third option: enrolling in the top-secret magic school Royal Biblia Academy. Waiting for him at the academy are seven beautiful magic users, the Trinity Seven, each with her own power and skill. With so many women surrounding him, there are plenty of opportunities to have some silly perverted fun.

But it’s not all fun and games for Arata. Spurred on by the memory of his cousin and childhood friend Hijiri Kasuga, Arata will stop at nothing to stop the destruction of the world and bring his best friend back.",2014-10-08,TV,25157
Digimon Adventure,"When a group of kids head out for summer camp, they don't expect it to snow in the middle of July. Out of nowhere, the kids receive strange devices which transport them to a very different world to begin their Digimon Adventure! Led by the plucky Taichi Yagami, the seven children must now survive in a realm far from home, filled with monsters and devoid of other humans.

Luckily, they're not alone: each child is paired off with a companion digital monster called a Digimon. Together, the children and their new friends must overcome their insecurities, discover their inner strengths, and evolve into stronger fighters - literally.

A force of evil is spreading through the Digital World, corrupting all the Digimon. The DigiDestined have arrived and it’s up to them to save the Digital World, if they ever want to see their home world again.",1999-03-07,TV,552
Evangelion: 2.0 You Can (Not) Advance,"When the threat of the Angel menace escalates, mankind's defense force is pushed to its limits, with Nerv at the forefront of the struggle. Shinji Ikari and his partner Rei Ayanami are assisted by two new pilots: the fiery Asuka Langley and the mysterious Mari Makinami.

With the aid of their mechanized Evangelion units, equipped with weapons perfect for engaging their monstrous opponents, the four young souls fight desperately to protect their loved ones and prevent an impending apocalypse. But when startling secrets are brought to light, will the heroes’ greatest challenge prove to be the monsters...or humanity itself?

[Written by MAL Rewrite]",2009-07-27,Movie,3784
Sekirei,"It was a moment in the world’s history not recorded in any textbook. A spaceship crashed to Earth carrying within it a number of powerful, humanoid beings called Sekirei. Their physical and elemental powers are remarkable enough, but by kissing certain human individuals with special genes called Ashikabi, the Seikirei can form a bond with them that awakens a deeper power within the Sekirei themselves.

Sekirei tells the story of Minato Sahashi, a 19 year old teenager who can’t seem to successfully pass his college entrance exams. He’s already failed them twice, and has become a bit of a laughingstock to those who know him. But any plans he had for his future change when a Sekirei named Musubi crashes into him while trying to escape from two others of her kind. She recognizes the Ashikabi genes in the seemingly useless Minato, and to his great surprise, kisses him.

Minato is now an unwilling participant in a game known as the “Sekirei Plan” where he and Musubi must fight for survival against all the other Sekirei and Ashikabi. The victors, according to Musubi, will be able to ascend to the higher sky, but the fate of the Earth might be at stake as well.",2008-07-02,TV,4063
Fate/stay night: Unlimited Blade Works 2nd Season,"Fuyuki City will be changed forever following the events that will come to be known as the Fifth Holy Grail War. With the Masters and Servants slowly revealing themselves and their intentions, the stage is set for the grand finale, and at the center of it all is Shirou Emiya and Rin Toosaka.
The Holy Grail War continues, with each Master and Servant duo making their move for the omnipotent wish granter. Caster’s plans have been set in motion, beginning with taking Saber captive while Rin and Archer go their separate ways to continue their fights on their own. Without Saber’s aid, Shirou’s principles are put to the ultimate test. With many battles to come with expected and unexpected enemies, Shirou’s resolve begins to take form. Is his desire to protect people and become a hero, genuine? Or are they simply borrowed feelings? And will it be enough to carry him to the end?

(Source: Aniplex USA)",2015-04-05,TV,28701
Durarara!!x2 Shou,"Half a year after the turmoil that rocked the entire city of Ikebukuro, peace has once again returned to the city, and people are living each day normally. The high school students enjoy their days of youth as the strongest and most dangerous man of Ikebukuro works diligently. The informant plots (or plans) a new scheme and the headless rider is pursued by the cops as she rides through the night... But soon this normal will be cut short by the abnormal. Slowly but surely, the unknown will seize the city and face an all new storm.

(Source: Aniplex USA)",2015-01-10,TV,23199
Full Metal Panic? Fumoffu,"It's back-to-school mayhem with Kaname Chidori and her war-freak classmate Sousuke Sagara as they encounter more misadventures in and out of Jindai High School. But when Kaname gets into some serious trouble, Sousuke takes the guise of Bonta-kun—the gun-wielding, butt-kicking mascot. And while he struggles to continue living as a normal teenager, Sousuke also has to deal with protecting his superior officer Teletha Testarossa, who has decided to take a vacation from Mithril and spend a couple of weeks as his and Kaname's classmate.

(Source: ANN)",2003-08-26,TV,72
Hai to Gensou no Grimgar,"Fear, survival, instinct. Thrown into a foreign land with nothing but hazy memories and the knowledge of their name, they can feel only these three emotions resonating deep within their souls. A group of strangers is given no other choice than to accept the only paying job in this game-like world—the role of a soldier in the Reserve Army—and eliminate anything that threatens the peace in their new world, Grimgar.

When all of the stronger candidates join together, those left behind must create a party together to survive: Manato, a charismatic leader and priest; Haruhiro, a nervous thief; Yume, a cheerful hunter; Shihoru, a shy mage; Mogzo, a kind warrior; and Ranta, a rowdy dark knight. Despite its resemblance to one, this is no game—there are no redos or respawns; it is kill or be killed. 

It is now up to this ragtag group of unlikely fighters to survive together in a world where life and death are separated only by a fine line. 

[Written by MAL Rewrite]",2016-01-11,TV,31859
Kore wa Zombie Desu ka? of the Dead,"Aikawa Ayumu was revived as a zombie by the cute necromancer Eucliwood Hellscythe. After the zany, madcap adventures in the first season of Is This a Zombie? ended, Ayumu thought his life might finally get back to normal, or as normal as it can be for a zombie. However, destiny has other plans for him. Some guys just can't catch a break. 

(Source: FUNimation)",2012-04-05,TV,10790
Wolf's Rain,"In some distant future, it's common knowledge that all wolves have been extinct for 200 years. However, it seems this is false as wolves have not disappeared but rather have taken human form. Kiba, a lone wolf, wanders into a city, trying to sniff out the Lunar Flowers that are supposed to lead whoever follows the scent to paradise. The source of the smell is Cheza, a girl who sleeps in what appears to be suspended animation in a lab. She and the wolves are drawn to each other, and Kiba hopes to find paradise once he finds the source of the scent of Lunar Flowers. However, once Kiba finds Cheza, she is kidnapped by a mysterious person called Darcia, and his search begins anew. Before he leaves the city, he meets 3 other wolves, Tsume, Hige and Toboe. All four wolves have very different personalities and ideas, and their friendliness towards each other is a little rough around the edges. However, they soon band together to continue to search for paradise. 

(Source: ANN)",2003-01-07,TV,202
Kara no Kyoukai 1: Fukan Fuukei,"In September 1998, a string of seemingly random suicides leaves Japan baffled and devastated. But a detective agency specializing in paranormal occurrences notices that there are a few glaring, disturbing similarities tying the deceptively unrelated cases together: All the victims are schoolgirls, and all of them have jumped to their deaths from atop the ancient Fujou Building, a skyscraper that is scheduled to be bulldozed soon.

To investigate the cause of these disturbing events, the head of the agency, magus Touko Aozaki, dispatches Mikiya Kokutou and Shiki Ryougi. The kind and surprisingly normal Mikiya serves as a stark contrast to the cold and mysterious Shiki, who possesses the ""Mystic Eyes of Death Perception"": an abnormal ability which allows her to see, and bring, an end to all things.

Dark and philosophical in tone, Fukan Fuukei is the first installment in the seven-part movie series Kara no Kyoukai, adapted from the light novels by Kinoko Nasu.

[Written by MAL Rewrite]",2007-12-01,Movie,2593
God Eater,"Anime adaptation of Bandai Namco's PSP action game series ""God Eater.""

Set in a post-apocalyptic Japan in the year 2071. The world has been mostly destroyed by mysterious monsters known as the Aragami. An organization known as Fenrir was made to exterminate Aragami using 'God Arcs', weapons made from Aragami cells. Those who specialize in exterminating Aragami are known as God Eaters. Their God Arcs originally could only keep a single form, however a new type has been discovered that can switch between gun and blade form. Since then, they have been classified new-types and the previous as old-types.",2015-07-12,TV,27631
Suisei no Gargantia,"In the distant future, a majority of humans have left the Earth, and the Galactic Alliance of Humanity is founded to guide exploration and ensure the prosperity of mankind. However, a significant threat arises in the form of strange creatures called Hideauze, resulting in an interstellar war to prevent humanity's extinction. Armed with Chamber, an autonomous robot, 16-year-old lieutenant Ledo of the Galactic Alliance joins the battle against the monsters. In an unfortunate turn of events, Ledo loses control during the battle and is cast out to the far reaches of space, crash-landing on a waterlogged Earth.

On the blue planet, Gargantia—a large fleet of scavenger ships—comes across Chamber and retrieves it from the ocean, thinking they have salvaged something of value. Mistaking their actions for hostility, Ledo sneaks aboard and takes a young messenger girl named Amy hostage, only to realize that the residents of Gargantia are not as dangerous as he had believed. Faced with uncertainty, and unable to communicate with his comrades in space, Ledo attempts to get his bearings and acclimate to a new lifestyle. But his peaceful days are about to be short-lived, as there is more to this ocean-covered planet than meets the eye. 

[Written by MAL Rewrite]",2013-04-07,TV,16524
Devil May Cry,"Devil May Cry follows the story of the demon hunter known as Dante. As a half demon, half human, he uses his trusty sword Rebellion and his two guns Ebony and Ivory to take on missions. Dante owns and runs ""Devil May Cry,"" a business that specializes in hunting and killing demon-related problems.

Based on the video game series ""Devil May Cry.""",2007-06-14,TV,1726
Koutetsujou no Kabaneri,"As the world is in the middle of an industrial revolution, a monster appears that cannot be defeated unless its heart, which is protected by a layer of iron, is pierced. By infecting humans with its bite, the monster can create aggressive and undead creatures known as Kabane. On the island Hinomoto, located in the far east, people have built stations to shelter themselves from these creatures. People access the station, as well as transport wares between them, with the help of a locomotive running on steam, called Hayajiro. Ikoma, a boy who lives in the Aragane station and helps to build Hayajiro, creates his own weapon called Tsuranukizutsu in order to defeat the creatures. One day, as he waits for an opportunity to use his weapon, he meets a girl named Mumei, who is excused from the mandatory Kabane inspection. During the night, Ikoma meets Mumei again as he sees Hayajiro going out of control. The staff on the locomotive has turned into the creatures. The station, now under attack by Kabane, is the opportunity Ikoma has been looking for.

(Source: MAL News)",2016-04-08,TV,28623
Hidan no Aria,"In response to the worsening crime rate, Japan creates Tokyo Butei High, an elite academy where ""Butei"" or armed detectives hone their deadly skills in hopes of becoming mercenary-like agents of justice. One particular Butei is Kinji Tooyama, an anti-social and curt sophomore dropout who was once a student of the combat-centric Assault Division. Kinji now lives a life of leisure studying logistics in order to cover up his powerful but embarrassing special ability. However, his peaceful days soon come to an end when he becomes the target of the infamous ""Butei Killer,"" and runs into an emotional hurricane and outspoken prodigy of the highest rank, Aria Holmes Kanzaki, who saves Kinji's life and demands that he become her partner after seeing what he is truly capable of.

[Written by MAL Rewrite]",2011-04-15,TV,8630
Shaman King,"A battle is about to begin in Tokyo: the Shaman Fight, a tournament held every five hundred years where shaman—those who can command spirits—confront each other in combat. The victor of this contest becomes the Shaman King and the only one who is able to contact and control the Great Spirit, allowing them to reshape the world as they please through its immense power.

During a late night walk, Manta Oyamada runs into his classmate, the carefree You Asakura, who invites him to come stargazing with some friends, who, to Manta's horror, turn out to be ghosts from a local cemetery! However, the knowledge that Manta possesses—a rare sixth sense that allows Manta to see these spirits—endears the boy to You. So when You finds out that his new comrade has been beaten up by a local gang, he decides to avenge him with the help of Amidamaru, a samurai ghost whose tomb was broken by the gang leader. 

Soon Manta uncovers more about the world of spirits, including the Shaman Fight, in which his new friend You aims to claim victory.

[Written by MAL Rewrite]",2001-07-04,TV,154
High School DxD BorN,"The babes and boys of the Occult Research Club are Back! Lovable loser (and bust buff) Issei and his clan of bewitching beauties return for a new season of supernatural tussles and sexy shenanigans—featuring old friends and new enemies! Now that all the girls live in Issei’s home, life seems like nothing but fun and scantily-clad lounging…for now! Join Rias, Akeno, Koneko, Asia, Xenovia, Gasper, and everyone’s favorite Harem King Issei as they fight, fumble, and fondle their way through their demonic high school lives.

(Source: FUNimation)",2015-04-04,TV,24703
Gantz,"Thought your life was bad? Sometimes, death is worse. There is no salvation, peace, nor god waiting to receive you into their care. But wait, a god? Maybe you are talking about that big black ball stuck in the room with you. Now you are thrown into a game, fighting green aliens and robot monsters for the chance to survive.

When Kei Kurono is killed, he thus finds himself caught in such a game—a test of his skills, morals, and will to survive. His life is not his own; his death is spat and trampled upon over and over again. What happens if he does not listen? God knows.

A word of warning: Gantz is not for the faint-hearted, but neither is it as simple as it looks. Gore, rape, and violence is rampant, as are portrayals of greed, violence, and all the ugliness that one sees in society today.

[Written by MAL Rewrite]",2004-04-13,TV,384
No.6,"Following years of war, civilization has rebuilt itself into a technological marvel. Cities, while heavily regulated by the government, promote beautiful, peaceful lives. A young, extremely intelligent boy named Shion resides in No.6, one such city. He lives a sheltered, comfortable life as a member of the upper class, and has never wanted for anything, or seen hardship. On the day of his 12th birthday, during the middle of a heavy storm, Shion is shocked to find another young boy who identifies himself by the name, ""Nezumi,"" has snuck into his room.

Shion's gentle nature leads him to try and nurse Nezumi back to health while Nezumi makes a series of statements that call into question Shion's trusting personality, idyllic life, and the seemingly perfect society that they live in. What's more, Shion finds out that Nezumi is wanted by the government for being an escaped prisoner. Not wanting to turn Nezumi over and feeling a bond to him that defies explanation, Shion is unknowingly about to embark on an adventure that will not only change his life forever, but in time, also reveal the dark and twisted secrets behind the city of No.6.",2011-07-08,TV,10161
JoJo no Kimyou na Bouken (TV),"In 1868, Dario Brando saves the life of an English nobleman, George Joestar. By taking in Dario's son Dio when the boy becomes fatherless, George hopes to repay the debt he owes to his savior. However Dio, unsatisfied with his station in life, aspires to seize the Joestar house for his own. Wielding an Aztec stone mask with supernatural properties, he sets out to destroy George and his son, Jonathan ""JoJo"" Joestar, and triggers a chain of events that will continue to echo through the years to come.

Half a century later, in New York City, Jonathan's grandson Joseph Joestar discovers the legacy his grandfather left for him. When an archeological dig unearths the truth behind the stone mask, he realizes that he is the only one who can defeat the Pillar Men, mystical beings of immeasurable power who inadvertently began everything.

Adapted from the first two arcs of Hirohiko Araki's outlandish manga series, JoJo no Kimyou na Bouken follows the many thrilling expeditions of JoJo and his descendants. Whether it's facing off with the evil Dio, or combatting the sinister Pillar Men, there's always plenty of bizarre adventures in store.

[Written by MAL Rewrite]",2012-10-06,TV,14719
Full Metal Panic! The Second Raid,"This series is set about two months after the events ocurred in the Tuatha de Danaan at the end of the original series. Mithril becomes aware of a secret organization that has technology able to counter the ECS (Electronic Cloaking System) mode. This organization, known as Amalgam, also has ""Black Technology,"" obtained from ""Whispered"" like Kaname Chidori, and like the other intelligence agencies, they intend to obtain more; however, when Sousuke's mission to protect Chidori is terminated by Mithril, all seems to be in place for Amalgam's plans...

(Source: ANN)",2005-07-14,TV,73
Hunter x Hunter,"Hunters are specialized in a wide variety of fields, ranging from treasure hunting to cooking. They have access to otherwise unavailable funds and information that allow them to pursue their dreams and interests. However, being a hunter is a special privilege, only attained by taking a deadly exam with an extremely low success rate.

Gon Freecss, a 12-year-old boy with the hope of finding his missing father, sets out on a quest to take the Hunter Exam. Along the way, he picks up three companions who also aim to take the dangerous test: the revenge-seeking Kurapika, aspiring doctor Leorio Paladiknight, and a mischievous child the same age as Gon, Killua Zoldyck.

Hunter x Hunter is a classic shounen that follows the story of four aspiring hunters as they embark on a perilous adventure, fighting for their dreams while defying the odds.

[Written by MAL Rewrite]",1999-10-16,TV,136
Owari no Seraph: Nagoya Kessen-hen,"Yuuichirou has reunited with Mikaela at the Shinjuku Battle. But Mikaela was turned into a vampire... To save the ""family,"" and to protect his fellow members, Yuuichirou needed to gain knowledge and power. He searched for ways to bring back vampire to human beings, and at the same time, trained hard working on the Cursed Gear. 

Meanwhile, Kureto calls Guren and tells him a shocking truth. That in one month, the main unit of the vampire will start attacking Tokyo. To get a head start against vampires, Kureto orders Guren to go to Nagoya. The noble extermination mission is about to open fire!

(Source: Official website)",2015-10-10,TV,28927
Freezing,"Decades into the future, humanity is under siege by an alien race known as the Novas. These inhuman beings leave devastation in their wake whenever they appear, with the efforts to stave them off becoming known as Nova Clashes. Young women known as ""Pandoras"" and young men known as ""Limiters"" are implanted with stigmata to give them superhuman powers and are trained in military academies, where they must learn to work together if humanity is to have a chance of surviving.

Freezing tells the story of Kazuya Aoi as he sets out for his first day at the West Genetics military academy, right when a battle royale is being undertaken by the Pandoras. It is here that he mistakes Satellizer el Bridget—a powerful Pandora known as the ""Untouchable Queen""—as his deceased sister and embraces her. Though he costs her the match, she finds that his touch doesn't drive her away and decides to take him as her Limiter. The only question is whether or not their partnership can survive the machinations of their upperclassmen and the impending battle with the Novas…",2011-01-08,TV,9367
Bleach Movie 1: Memories of Nobody,"In Karakura Town, there has been a sudden outbreak of unidentifiable spirits called ""blanks"" (vacant souls) while in the skies of Soul Society, the real world has been reflected. A mysterious female shinigami called Senna has appeared before Ichigo along with a man named Ganryu, leading a group called the ""Dark Ones.""

(Source: ANN)",2006-12-16,Movie,1686
C: The Money of Soul and Possibility Control,"The Japanese government was rescued from the brink of financial collapse by the Sovereign Wealth Fund. For its citizens, however, life has not improved and unemployment, crime, suicide, and despair are rampant. Kimimaro, raised by his maternal aunt after the disappearance of his father and the death of his mother, is a scholarship student whose only dream is to live a stable, ordinary life. One day he meets a man who offers him a large sum of money if he will allow his ""future"" to be held as collateral. From then on his fate is radically altered as he's drawn into a mysterious realm known as the Financial District, where he must compete in weekly tournaments called ""deals"" in order to keep his money and avoid losing his future. 

(Source: Wikipedia)",2011-04-15,TV,10163
Hitsugi no Chaika,"Hitsugi no Chaika is about the quest of a pretty and charming 14-year old sorceress named Chaika Trabant, who carries a coffin on her back. She is surprisingly adept in casting high-precision spells, but she has no memory of her past. The only thing she knows is to gather the scattered remains of Emperor Gaz. Toru Acura is a Saboteur who relies on his adoptive sister Akari for their food. After the fall of Gaz Empire, he finds it difficult to land a job until he meets Chaika in the woods, and agrees to help her accomplish her quest along with Akari.

The unlikely trio sets on the journey with a clear goal in mind, unaware of the dangerous truth.",2014-04-10,TV,20853
